{
  "schema": "openagent.sustained_power_thermal_evidence.v1",
  "status": "blocked",
  "claim_boundary": "template_and_local_estimate_only_not_measured_silicon",
  "target": {
    "name": "openagent-e1-npu",
    "substrate": "local_estimate_only",
    "board_serial": "blocked_until_first_article_or_silicon_target_exists",
    "soc_revision": "blocked_until_measured_silicon_exists"
  },
  "workload": {
    "plan_id": "e1-npu-sustained-int8-v1",
    "duration_seconds": 1800,
    "warmup_seconds": 120,
    "commands": [
      [
        "adb",
        "shell",
        "benchmark_model",
        "--graph=/data/local/tmp/mobile_smoke.tflite",
        "--use_nnapi=true",
        "--nnapi_accelerator_name=e1-npu",
        "--enable_op_profiling=true",
        "--num_threads=1",
        "--min_secs=1800"
      ]
    ]
  },
  "measurement_environment": {
    "ambient_c": 25,
    "cooling": "blocked_until_lab_airflow_or_enclosure_state_recorded",
    "enclosure": "blocked_until_board_or_phone_fixture_recorded",
    "operator": "blocked_until_lab_operator_recorded"
  },
  "instrumentation": {
    "capture_statuses": {
      "power_meter_calibrated": "blocked",
      "thermal_sensor_calibrated": "blocked",
      "frequency_source_recorded": "blocked",
      "workload_transcript_recorded": "blocked",
      "throttle_state_recorded": "blocked",
      "same_window_alignment_checked": "blocked"
    },
    "power": [
      {
        "rail": "VDDCORE",
        "instrument": "blocked_until_calibrated_power_analyzer_or_supply_log",
        "sample_hz": 10,
        "measurement_point": "blocked_until_sense_resistor_or_supply_channel_recorded"
      },
      {
        "rail": "VDDIO",
        "instrument": "blocked_until_calibrated_power_analyzer_or_supply_log",
        "sample_hz": 10,
        "measurement_point": "blocked_until_sense_resistor_or_supply_channel_recorded"
      }
    ],
    "thermal": [
      {
        "sensor": "die_or_package_sensor",
        "instrument": "blocked_until_calibrated_sensor_recorded",
        "sample_hz": 1,
        "location": "blocked_until_die_package_board_location_recorded"
      }
    ],
    "frequency": [
      {
        "domain": "e1-npu",
        "source": "blocked_until_clock_frequency_trace_or_register_dump",
        "sample_hz": 1
      }
    ]
  },
  "artifacts": {
    "power_trace": {
      "path": "docs/manufacturing/evidence/power/e1-npu/power-trace.csv",
      "sha256": "0000000000000000000000000000000000000000000000000000000000000000",
      "sample_count": 0
    },
    "thermal_trace": {
      "path": "docs/manufacturing/evidence/thermal/e1-npu/thermal-trace.csv",
      "sha256": "0000000000000000000000000000000000000000000000000000000000000000",
      "sample_count": 0
    },
    "frequency_trace": {
      "path": "docs/manufacturing/evidence/power/e1-npu/frequency-trace.csv",
      "sha256": "0000000000000000000000000000000000000000000000000000000000000000",
      "sample_count": 0
    },
    "workload_transcript": {
      "path": "docs/manufacturing/evidence/power/e1-npu/workload-transcript.txt",
      "sha256": "0000000000000000000000000000000000000000000000000000000000000000",
      "sample_count": 0
    },
    "calibration_record": {
      "path": "docs/manufacturing/evidence/power/e1-npu/power-thermal-calibration.json",
      "sha256": "0000000000000000000000000000000000000000000000000000000000000000",
      "sample_count": 0
    }
  },
  "computed_metrics": {
    "average_watts": 0,
    "max_die_c": 0,
    "sustained_int8_tops": 0,
    "sustained_tops_per_w": 0,
    "throttle_state": "blocked"
  },
  "release_blockers": [
    "No measured silicon or complete-phone target exists in this repository.",
    "No calibrated power trace, thermal trace, frequency trace, workload transcript, or calibration record is archived.",
    "Local OpenLane power and NPU architecture-model TOPS are cross-substrate arithmetic only and cannot be used as sustained TOPS/W evidence."
  ]
}
